{
  "schemaVersion": 1,
  "programId": "shrubbery-garden-fidelity",
  "title": "Garden → Shrubbery exhaustive functional acceptance",
  "oracle": {
    "repository": "../sophia/garden",
    "commit": "cf0cb9600ba25ee49f7268301bcf3d949ed48f3b",
    "entrypoints": [
      "frontend/src/app-shell.ts",
      "frontend/src/lib/capabilities.ts",
      "frontend/src/lib/testids.ts",
      "frontend/src/components",
      "frontend/src/services",
      "parity/local-loopback-surface.json"
    ],
    "supplementalHarness": {
      "commit": "8673381",
      "paths": [
        "frontend/playwright.local.config.ts",
        "frontend/e2e-local/fixtures/outliner.ts",
        "frontend/e2e-local"
      ],
      "status": "dormant-reference-only"
    }
  },
  "target": {
    "repository": "shrubbery",
    "commitPolicy": "record the tested git SHA and dirty-tree hash in every run",
    "primaryApp": "apps/organism",
    "backend": "fresh-profile local gardend",
    "browser": "Playwright Chromium"
  },
  "verdicts": ["PASS", "FAIL", "BLOCKED", "NOT-APPLICABLE"],
  "tiers": {
    "T0-component": "Happy DOM and Storybook contracts; never sufficient for product fidelity",
    "T1-inmemory-browser": "Real Chromium against the deterministic in-process cell contract",
    "T2-local-cell": "Real Chromium against a fresh full local gardend",
    "T3-resilience-collaboration": "Multiple clients, restart, persistence, latency, disconnect and recovery",
    "T4-hosted-blocked": "Hosted-only or backend-contract-blocked behavior, run separately and never credited as local PASS",
    "T5-external": "Disposable external-service accounts or explicit BLOCKED verdicts",
    "T6-safety-gated": "Destructive behavior with declared fixture scope and action-time approval"
  },
  "modes": [
    "component-fixture",
    "inmemory-browser",
    "local-cell",
    "local-cell-two-browser",
    "local-desktop-tauri",
    "hosted-gateway",
    "public-anonymous",
    "external-service"
  ],
  "journeys": [
    {
      "id": "ACC-J010",
      "order": 10,
      "title": "Component contracts and visual-state discovery",
      "tier": "T0-component",
      "capabilities": ["ACC-CAP-DESIGN-001", "ACC-CAP-CHROME-002", "ACC-CAP-A11Y-001"],
      "modes": ["component-fixture"],
      "roles": ["anonymous"],
      "fixture": "Storybook deterministic stories; Garden/Emporium skins; light/dark; loading/empty/error/disabled states",
      "pairwiseDimensions": ["skin × theme", "default × loading × empty × error", "mouse × keyboard"],
      "steps": [
        {"id": "discover", "action": "Build Storybook, enumerate catalog and compare the source-derived surface census.", "expected": "No unexplained missing or duplicate surface; every interactive control has a named state story.", "evidence": ["console", "screenshot", "catalog-diff"]},
        {"id": "interact", "action": "Drive representative controls in real Chromium under pairwise skin/theme/state combinations.", "expected": "State changes and emitted intents match the controlled contract with no page/console errors.", "evidence": ["trace", "screenshot", "console", "page-errors"]}
      ],
      "command": "pnpm acceptance:run --journey ACC-J010 --headed={true|false}"
    },
    {
      "id": "ACC-J020",
      "order": 20,
      "title": "Deterministic in-memory real-browser shell smoke",
      "tier": "T1-inmemory-browser",
      "capabilities": ["ACC-CAP-HOME-001", "ACC-CAP-CHROME-001", "ACC-CAP-CHROME-002", "ACC-CAP-MOBILE-001", "ACC-CAP-EDIT-001", "ACC-CAP-TTS-001", "ACC-CAP-CHAT-001", "ACC-CAP-CHAT-002"],
      "modes": ["inmemory-browser"],
      "roles": ["local-owner"],
      "fixture": "apps/organism browser-harness in-memory cell contract",
      "pairwiseDimensions": ["desktop × mobile", "light × dark", "editor × chat × wires rerender"],
      "steps": [
        {"id": "desktop", "action": "Open a document, type, switch documents, change theme, chat and open Wires.", "expected": "Live editor/chat survive shell rerenders and all visible state agrees with the read-only harness bridge.", "evidence": ["trace", "screenshot", "console", "page-errors"]},
        {"id": "speech-mobile", "action": "Exercise SpeechSynthesis controls, resize to phone tabs and back to desktop.", "expected": "Speech is cleaned up on document change; editor/chat retain exact node identity and content.", "evidence": ["trace", "screenshot", "browser-state"]}
      ],
      "command": "pnpm --dir apps/organism exec tsx scripts/browser-harness.mts"
    },
    {
      "id": "ACC-J100",
      "order": 100,
      "title": "Route, landing and legal preflight",
      "tier": "T2-local-cell",
      "capabilities": ["ACC-CAP-ROUTE-001"],
      "modes": ["local-cell", "hosted-gateway"],
      "roles": ["anonymous"],
      "fixture": "fresh browser context with empty storage",
      "pairwiseDimensions": ["direct URL × in-app navigation", "Garden × Sophia landing"],
      "steps": [
        {"id": "landings", "action": "Visit each landing alias and activate primary/back actions.", "expected": "Correct landing renders and navigation is URL-consistent without authenticated state mutation.", "evidence": ["trace", "screenshot", "network"]},
        {"id": "legal", "action": "Open privacy and terms directly and through landing links.", "expected": "The correct local legal artifact renders with a meaningful frame title and no mixed-content error.", "evidence": ["screenshot", "console", "page-errors"]}
      ],
      "command": "pnpm acceptance:run --journey ACC-J100"
    },
    {
      "id": "ACC-J110",
      "order": 110,
      "title": "Home and desktop shell",
      "tier": "T2-local-cell",
      "capabilities": ["ACC-CAP-HOME-001", "ACC-CAP-HOME-002", "ACC-CAP-CHROME-001", "ACC-CAP-CHROME-002", "ACC-CAP-CHROME-003"],
      "modes": ["local-cell"],
      "roles": ["local-owner"],
      "fixture": "seeded home graph with pinned/new/recent/daily/dream documents",
      "pairwiseDimensions": ["home with last-doc × no last-doc", "light × dark", "single × split pane"],
      "steps": [
        {"id": "home", "action": "Open Home; use Resume, New, Today, Dream Journal, pinned/new/recent entries.", "expected": "Each affordance resolves the intended graph-scoped document and only New creates state.", "evidence": ["trace", "screenshot", "network", "graph-before-after"]},
        {"id": "chrome", "action": "Exercise breadcrumbs, back/forward, switcher, theme, panels, resize/collapse, focus and split.", "expected": "Layout and navigation transitions are reversible; active editor identity/content remain stable where Garden promises stability.", "evidence": ["trace", "screenshot", "browser-state"]}
      ],
      "command": "pnpm acceptance:run --journey ACC-J110"
    },
    {
      "id": "ACC-J120",
      "order": 120,
      "title": "Workspace tenancy and graph isolation",
      "tier": "T2-local-cell",
      "capabilities": ["ACC-CAP-TENANCY-001", "ACC-CAP-TENANCY-002", "ACC-CAP-TENANCY-003"],
      "modes": ["local-cell"],
      "roles": ["local-owner"],
      "fixture": "two graph fixtures with deliberately colliding document labels and distinct content",
      "pairwiseDimensions": ["graph A → B × B → A", "empty graph × populated graph"],
      "steps": [
        {"id": "catalog", "action": "List, create and rename a fixture workspace, then switch among all fixture graphs.", "expected": "Catalog labels/roles update and each switch binds only the selected graph's providers/data.", "evidence": ["trace", "network", "backend-log", "graph-before-after"]},
        {"id": "isolation", "action": "Change content, pins and wires in Graph A, visit Graph B, then return.", "expected": "No cross-graph leakage; Graph A state returns exactly and Graph B hashes remain unchanged.", "evidence": ["screenshot", "graph-before-after", "crdt-hashes"]}
      ],
      "command": "pnpm acceptance:run --journey ACC-J120"
    },
    {
      "id": "ACC-J130",
      "order": 130,
      "title": "Sidebar document/folder mutation and organization",
      "tier": "T2-local-cell",
      "capabilities": ["ACC-CAP-NAV-001", "ACC-CAP-NAV-002"],
      "modes": ["local-cell"],
      "roles": ["local-owner"],
      "fixture": "nested folders, editable docs, artifacts and one read-only imported doc",
      "pairwiseDimensions": ["document × folder", "menu × drag/drop", "single × batch"],
      "steps": [
        {"id": "crud", "action": "Create/rename documents and folders; move by dialog and drag/drop; reorder siblings.", "expected": "Visible tree order and authoritative workspace projection converge without duplicates.", "evidence": ["trace", "screenshot", "network", "graph-before-after"]},
        {"id": "batch", "action": "Select multiple safe fixture nodes, batch move, cancel delete, then confirm deletion of disposable nodes.", "expected": "Selection/action scope is correct; cancel is zero-delta; confirm removes only allowlisted fixture IDs.", "evidence": ["trace", "effects-ledger", "graph-before-after"]}
      ],
      "command": "pnpm acceptance:run --journey ACC-J130"
    },
    {
      "id": "ACC-J140",
      "order": 140,
      "title": "Sidebar discovery, pins, daily notes and source-document actions",
      "tier": "T2-local-cell",
      "capabilities": ["ACC-CAP-NAV-003", "ACC-CAP-NAV-004", "ACC-CAP-NAV-005"],
      "modes": ["local-cell"],
      "roles": ["local-owner"],
      "fixture": "dated, tagged, connected, nested and imported source documents",
      "pairwiseDimensions": ["five sort criteria pairwise with direction", "folder visible × hidden", "parsed × read-only source"],
      "steps": [
        {"id": "organize", "action": "Search, sort, reverse, group and filter; open a tag; pin/unpin and open split.", "expected": "Result membership/order follows the selected rule while underlying tree/state is unchanged except pin state.", "evidence": ["trace", "screenshot", "browser-state"]},